question,ref,answer,option_a,option_b,option_c,option_d
"Na aula ""17-308 General AWS Certification Exam Tips"", qual serviço ou conceito é o foco principal para cenários de engenharia de dados na AWS?",17-308 General AWS Certification Exam Tips,A,Amazon EMR,Amazon S3,AWS Glue,Amazon Kinesis Data Streams
"Uma equipe precisa aplicar os conceitos de ""17-308 General AWS Certification Exam Tips"" com baixa latência e alta escalabilidade. Qual opção é a mais aderente ao contexto da aula?",17-308 General AWS Certification Exam Tips,B,AWS Glue,Amazon EMR,Amazon S3,Amazon Kinesis Data Streams
"A aula ""17-308 General AWS Certification Exam Tips"" é relevante para preparação da certificação AWS Data Engineer porque ajuda em decisões de arquitetura de dados.",17-308 General AWS Certification Exam Tips,A,Verdadeiro,Falso,,
"No contexto de ""17-308 General AWS Certification Exam Tips"", habilitar monitoramento e métricas no Amazon CloudWatch ajuda no troubleshooting de pipelines.",17-308 General AWS Certification Exam Tips,A,Verdadeiro,Falso,,
"Para reduzir custo mantendo análise de dados relacionada a ""17-308 General AWS Certification Exam Tips"", qual prática costuma ser mais recomendada?",17-308 General AWS Certification Exam Tips,C,Aumentar capacidade fixa sem medir uso,Desativar logs e monitoramento,Ajustar capacidade/particionamento conforme padrão de acesso,Duplicar dados em múltiplas regiões sem necessidade
"Qual alternativa melhor representa uma boa prática de segurança e governança associada ao tema ""17-308 General AWS Certification Exam Tips""?",17-308 General AWS Certification Exam Tips,D,Usar credenciais de root em aplicações,Liberar acesso público por padrão,Evitar criptografia para reduzir latência,Aplicar menor privilégio no IAM e criptografia em repouso/trânsito
"Em um cenário de prova, quando o assunto é ""17-308 General AWS Certification Exam Tips"", qual decisão melhora observabilidade operacional?",17-308 General AWS Certification Exam Tips,A,"Configurar métricas, logs e alarmes para detectar falhas rapidamente",Remover logs para economizar armazenamento,Executar jobs sem retries,Ignorar DLQ e tratamento de erro
"Quando ""17-308 General AWS Certification Exam Tips"" participa de uma arquitetura moderna, qual integração é mais comum para analytics?",17-308 General AWS Certification Exam Tips,B,Amazon Kinesis Data Streams,Amazon S3,Amazon Redshift,Amazon EC2 sem armazenamento de dados
"Para exame AWS Data Engineer, ""17-308 General AWS Certification Exam Tips"" deve ser analisado também sob o ponto de vista de resiliência e recuperação de falhas.",17-308 General AWS Certification Exam Tips,A,Verdadeiro,Falso,,
"Qual escolha está mais alinhada ao uso prático de ""17-308 General AWS Certification Exam Tips"" em pipelines de dados?",17-308 General AWS Certification Exam Tips,C,Ignorar schema e qualidade de dados,Evitar automação e orquestração,"Definir validação, segurança e monitoramento desde o desenho do pipeline",Concentrar toda transformação manualmente em ambiente local
